{"$schema":"https://json-schema.org/draft/2020-12/schema","$id":"https://sister.dev/contracts/reflexivity/1.0.0/reflexivity-profile.schema.json","type":"object","required":["profile_id","version","scope","depth","authority","mode","gate_effect","references","evaluator","allowed_actions","automatic_correction","human_approval_required"],"additionalProperties":false,"properties":{"profile_id":{"type":"string"},"version":{"type":"string"},"scope":{"type":"string"},"depth":{"type":"array","minItems":1,"items":{"enum":["D0","D1","D2","D3","D4","D5"]}},"authority":{"enum":["A0","A1","A2","A3","A4","A5"]},"mode":{"enum":["shadow","active"]},"gate_effect":{"enum":["shadow","pass","warn","block"]},"references":{"type":"array","items":{"type":"string"}},"evaluator":{"type":"object","required":["id","version"],"additionalProperties":false,"properties":{"id":{"type":"string"},"version":{"type":"string"}}},"allowed_actions":{"type":"array","items":{"enum":["none","collect_evidence","recommend","request_approval"]}},"automatic_correction":{"const":false},"human_approval_required":{"type":"boolean"}}}
